{
  "rpc_version": "0.1",
  "paper": {
    "title": "From Declaration to Evidence",
    "version": "preprint-v2",
    "venue": "Preprint",
    "venue_paper_id": "draft",
    "pdf_sha256": "bbbbbbbbbbbbbbbbbbbbbbbbbbbbbbbbbbbbbbbbbbbbbbbbbbbbbbbbbbbbbbbb"
  },
  "human_guarantor": {
    "orcid": "0000-0001-2345-6789",
    "name": "Jan Nehyba",
    "assertion_timestamp": "2026-07-20T08:10:00Z"
  },
  "ai_systems": [
    {
      "id": "ai1",
      "provider": "Anthropic",
      "model_family": "Claude",
      "model_version_or_snapshot": "2026-07",
      "interface": "chat",
      "operator_orcid": "0000-0001-2345-6789",
      "agent_identifier": {
        "scheme": "aicid",
        "value": "AICID:alpha-001"
      }
    }
  ],
  "activities": [
    {
      "role_id": "credit:writing_original_draft",
      "actor_id": "ai1",
      "evidence_level": "artifact_linked",
      "artifact_refs": ["log1"]
    },
    {
      "role_id": "credit:writing_review_editing",
      "actor_id": "human:0000-0001-2345-6789",
      "evidence_level": "declared"
    }
  ],
  "artifacts": [
    {
      "id": "log1",
      "type": "log",
      "sha256": "cccccccccccccccccccccccccccccccccccccccccccccccccccccccccccccccc",
      "access_status": "on_request",
      "restriction_reason": "Contains unpublished working material"
    }
  ],
  "checks": [
    {
      "check_type": "references_resolved",
      "result": "partial",
      "details": "1 unresolved reference",
      "tool": "refcheck.py",
      "subject_sha256": "bbbbbbbbbbbbbbbbbbbbbbbbbbbbbbbbbbbbbbbbbbbbbbbbbbbbbbbbbbbbbbbb",
      "timestamp": "2026-07-20T08:30:00Z"
    }
  ],
  "attestations": [
    {
      "attestor": {
        "scheme": "orcid",
        "value": "0000-0002-0000-0000"
      },
      "scope": "Reference resolution process",
      "method": "Manual spot check",
      "subject_sha256": "bbbbbbbbbbbbbbbbbbbbbbbbbbbbbbbbbbbbbbbbbbbbbbbbbbbbbbbbbbbbbbbb",
      "timestamp": "2026-07-20T09:00:00Z"
    }
  ]
}
